{"snapshot_id":"snapshot_aaaaaaaaaaaaaaaaaaaaaaaa","scan_id":"scan_aaaaaaaaaaaaaaaaaaaaaaaa","target_id":"target_bbbbbbbbbbbbbbbbbbbb","configuration_fingerprint":"aaaaaaaaaaaaaaaaaaaaaaaaaaaaaaaaaaaaaaaaaaaaaaaaaaaaaaaaaaaaaaaa","content_fingerprint":"bbbbbbbbbbbbbbbbbbbbbbbbbbbbbbbbbbbbbbbbbbbbbbbbbbbbbbbbbbbbbbbb","report":{"schema_version":"2.0","document_type":"scan_report","scan_id":"scan_aaaaaaaaaaaaaaaaaaaaaaaa","scanner":{"name":"SCAN","version":"2.0.0"},"started_at":"2026-08-20T00:00:00.000Z","completed_at":"2026-08-20T00:00:00.000Z","duration_ms":0,"target":{"input":"127.0.0.1/32","network":"127.0.0.1/32","target_id":"target_bbbbbbbbbbbbbbbbbbbb","ip_version":4},"configuration":{"ports":[]},"capabilities":{},"summary":{"assets_observed":0,"observations":0,"states":{"open":0,"closed":0,"unknown":0,"error":0},"errors":0},"assets":[],"observations":[],"errors":[]}}
